{"cleantext": "raj chauhan data science machine learning data analytics artificial intelligence surat gujarat 91 first preference remote work readytowork willing relocate pune maharashtra bengaluru karnataka navi mumbai maharashtra work experience student education computer engineering sarvajanik college engineering technology surat gujarat 2015 2019 higher secondary 12th pass vidyabharti high school 2014 senior secondary skills skills python core java javascript data analysis database management data structure data visualisation data wrangling google firebase aws mysql sql data analysis spark tableau ms office machine learning data science advanced mathematics statistics json xml google analytics google cloud platform c certifications licenses introduction data science essentials introduction machine learning", "education": ["ms"], "emails": ["rajchauhan396_vp3@indeedemail.com"], "experience": "2014", "industry_domain": ["MachineLearning", "Mechanicalengineer", "Manufacturing", "DataEngineering"], "job_title": ["MachineLearning", "Mechanicalengineer", "Manufacturing", "DataEngineering"], "keyphrases": ["data science", "machine learning data analytics", "artificial intelligence", "first preference", "maharashtra", "bengaluru", "karnataka", "navi", "mumbai", "maharashtra", "work experience", "student education", "computer engineering", "sarvajanik college", "engineering technology", "surat", "gujarat", "higher secondary 12th pass vidyabharti high school", "java javascript data analysis", "database management data structure", "data visualisation", "data wrangling", "google firebase aws mysql sql data analysis spark tableau ms office machine learning data science", "advanced mathematics", "statistics json xml google analytics google cloud platform c certifications licenses introduction data science essentials introduction machine learning"], "language_known": [], "location": ["gujarat", "pune", "bengaluru", "surat", "readytowork", "navi", "karnataka", "maharashtra", "mumbai"], "name": "raj chauhan", "phones": ["8780639136"], "raw_text": "Raj Chauhan\nData Science | Machine Learning | Data Analytics | Artificial Intelligence\nSurat, Gujarat\nrajchauhan396_vp3@indeedemail.com\n+91 8780639136\nFirst Preference is Remote Work\u00a0\n\u00a0\n#readytowork\nWilling to relocate to: Pune, Maharashtra - Bengaluru, Karnataka - Navi Mumbai, Maharashtra\n\nWork Experience\nStudent\n\nEducation\nBachelor of Engineering in (B.E.), Computer Engineering\nSarvajanik College of Engineering & Technology - Surat, Gujarat\n2015 to 2019\nHigher Secondary(12th Pass)\nVidyabharti High School\n2014\nSenior Secondary\n\nSkills / IT Skills\n\u2022 Python\n\u2022 Core Java\n\u2022 Javascript\n\u2022 Data Analysis\n\u2022 Database Management\n\u2022 Data Structure\n\u2022 Data Visualisation\n\u2022 Data Wrangling\n\u2022 Google Firebase\n\u2022 AWS\n\u2022 MySQL\n\u2022 Sql\n\u2022 Data Analysis\n\u2022 Spark\n\u2022 Tableau\n\n\f\u2022 MS Office\n\u2022 Machine Learning\n\u2022 Data Science\n\u2022 Advanced Mathematics\n\u2022 Statistics\n\u2022 JSON\n\u2022 Xml\n\u2022 Google Analytics\n\u2022 Google Cloud Platform\n\u2022 C++\n\nCertifications and Licenses\nIntroduction to Data Science Essentials\nIntroduction to Machine Learning\n\n\f", "resume_file": "ResumeRajChauhan", "technical_skills": ["python", "data science", "analytics", "firebase aws", "sql", "engineering", "c", "java", "javascript", "computer engineering", "artificial intelligence", "first preference", "data structure", "mysql"]}