{"cleantext": "akash verma 91 shiv nagar garh road hapur245101 uttarpradesh india change want see world career objective become successful professional field software engineering work environment utilize knowledge enhance interested devising better problemsolving method challenging tasks learning new technologies tools need arises education ajay kumar garg engineering college ghaziabad percentage 7250 till 7 semester ln public school hapur intermediate percentage 7980 dr apj abdul kalam technical university lucknow india aug 2016 till date central board secondary education cbse india 2015 2016 central board secondary education cbse india 2013 2014 logical ability computer science certification 74 84 certified data processing specialist certified amcat aspiring minds 11762707211 data structure algorithms machine learning neural networks opencv ln public school hapur high school cgpa 10 skill set area interest computer languages operating system others achievements amcat report python c ms office windows english comprehension 72 quantitative ability advanced 98 infosys certified software programmer certified software development trainee certified amcat aspiring minds 11762707166 extracurricular activity participated 2 prize vigyan ghar event held meerut 2015 participated antiragging poster making competition hobbies interest sketching watching movies singing personal details declare details correct true best knowledge akash verma father name mr rajkumar mother name mrs bala rani dob 10 august 1998 gender male nationality india religion hindu language hindi english", "education": ["ms", "cbse"], "emails": ["redulax@gmail.com"], "experience": [], "industry_domain": ["MachineLearning", "Medical", "Mechanicalengineer"], "job_title": ["MachineLearning", "Medical", "Mechanicalengineer"], "keyphrases": ["91 shiv nagar garh road", "knowledge", "new technologies", "ghaziabad percentage", "7 semester", "ln public school", "hapur", "intermediate percentage", "dr apj abdul kalam technical university", "lucknow", "india", "date", "central board secondary education cbse", "india", "logical ability computer science certification", "certified data processing specialist", "certified amcat", "aspiring minds", "11762707211 data structure algorithms", "machine learning", "neural networks", "opencv ln public school", "hapur high school", "cgpa", "10 skill set area interest", "computer languages", "operating system", "others achievements", "amcat report", "python c ms office windows", "english comprehension", "72 quantitative ability", "certified software development", "certified amcat", "aspiring minds", "11762707166", "extracurricular activity", "2 prize vigyan ghar event", "antiragging poster making competition", "hobbies interest", "sketching", "movies", "singing", "personal details", "details", "akash verma", "father name", "mr rajkumar", "mother name", "mrs bala rani", "dob", "gender male nationality", "india religion", "hindu language", "hindi english"], "language_known": ["english", "english"], "location": ["india", "amcat", "hapur", "lucknow", "ghaziabad", "hapur245101", "uttarpradesh"], "name": "akash verma", "phones": ["8218790353"], "raw_text": "Akash Verma \n\nB.TECH STUDENT \n\n(+91) 8218790353  |redulax@gmail.com \n\nShiv Nagar, Garh Road, Hapur-245101, Uttar-Pradesh, India \n\n\u201cBe the change that you want to see in the world.\u201d \n\n \n \n \n \n \n \nCareer Objective \n  \nTo become a successful professional in the field of software engineering and to work in an environment where I can utilize my \nKnowledge and enhance them. Interested in devising a better problem-solving method for challenging tasks, and learning new \ntechnologies and tools if the need arises. \n \nEducation \n  \nAjay Kumar Garg Engineering College, Ghaziabad \n \nB.TECH IN COMPUTER SCIENCE AND ENGINEERING \n\u2022 Percentage: 72.50 (till 7 semester) \nL.N. Public School, Hapur\u0398 \n \nINTERMEDIATE \n\u2022 Percentage: 79.80 \n\nDr. A.P.J. Abdul Kalam Technical \nUniversity, Lucknow, India \nAug. 2016 - Till Date \n\nCentral Board of Secondary \nEducation - CBSE, India \n2015 - 2016 \n\n \n\n \n\nCentral Board of Secondary \nEducation - CBSE, India \n2013 - 2014 \n\n \n\nLogical Ability \n\nComputer Science \n\n- \n\n \nCERTIFICATION \n \n\n74% \n\n84% \n\n- \n\nCertified Data Processing Specialist certified by AMCAT Aspiring Minds (11762707-211) \n\nData Structure,  Algorithms, Machine Learning, Neural Networks, OpenCV \n\nL.N. Public School, Hapur \n\n \nHIGH SCHOOL \n\u2022 CGPA: 10 \n \nSkill Set \n  \nAREA OF INTEREST \n \n \nCOMPUTER LANGUAGES \n \n \nOPERATING SYSTEM \n \n \nOTHERS \n \n \nAchievements \n  \nAMCAT REPORT \n \n\nPython, C \n\nMS Office \n\nWindows \n\nEnglish Comprehension \n\n72% \n\nQuantitative Ability (Advanced)  98% \n\n- \n\n- \n\n- \n\n\f \n\n- \n\n- \n\nInfosys Certified Software Programmer \n\nCertified Software Development Trainee certified by AMCAT Aspiring Minds (11762707-166) \n\n \nExtracurricular Activity \n  \n\u2022  Participated and won 2 prize in Vigyan ghar event held in Meerut in 2015 \n \n \n\u2022  Participated in Anti-ragging poster making competition \n \nHobbies and Interest \n \n \n \n\u2022  Sketching \n \n\u2022  Watching Movies \n \n\u2022  Singing \n \nPersonal Details \n  \n \n \n \n \n \n \n \n \nI declare that the details above are correct and true to the best of my knowledge. \n \nAkash Verma \n\nFather\u2019s Name Mr. Rajkumar \nMother\u2019s Name Mrs. Bala Rani \nDOB 10 August 1998 \nGender Male \nNationality India \nReligion Hindu \nLanguage Hindi, English \n\n\f", "resume_file": "ResumeAkashVerma", "technical_skills": ["python", "algorithms", "data processing", "engineering", "software", "windows", "languages", "data structure", "computer science", "operating system"]}