{"cleantext": "lead data scientist a115l a122l job aidetic scaling ai data engineering aidetic build end end ai solutions various industries sports finance ecommerce media etc aidetic helps business build capabilities predictive analytics scalable data engineering production level dlml models job description looking highly motivated data scientist strong algorithmic mindset problemsolving propensity since operating highly competitive market every opportunity increase efficiency cut costs critical candidate eye opportunities constantly innovating working novel hardware software high level flexibility celerity learning expected experience 36 years experience responsibilities algorithm development develop implement advanced algorithms extract actionable insights complex data sets contributing datadriven decisionmaking machine learning deep learning apply expertise python tensorflow pytorch scikitlearn build deploy machine learning deep learning models optimizing performance accuracy natural language processing nlp utilize nlp techniques including limited spacy nltk transformers extract valuable information unstructured text data enabling sentiment analysis topic modeling nlp applications data preprocessing feature engineering lead data preprocessing activities including data cleaning feature selection engineering ensure data quality model effectiveness model evaluation optimization continuously assess model performance implement strategies model optimization finetuning ensuring solutions remain stateoftheart efficiency enhancement identify exploit opportunities improve business processes reduce costs leveraging datadriven insights process automation resource allocation optimization crossfunctional collaboration collaborate crossfunctional teams including engineers product managers business analysts ensure seamless integration data science solutions products operations mentorship leadership provide guidance mentorship junior data scientists fostering growth knowledge field stay updated stay abreast latest developments data science machine learning ai ensure solutions remain cutting edge technology requirements strong proficiency python deep understanding data science libraries frameworks including tensorflow pytorch scikitlearn scipy spacy nltk transformers experience developing deploying deep learning models various applications expertise nlp techniques ability extract meaningful insights textual data exceptional problemsolving skills track record translating datadriven insights actionable recommendations strong leadership mentoring skills guide support junior data scientists adaptability keen desire continuous learning fastpaced innovative environment excellent communication collaboration skills work effectively crossfunctional teams benefits startup environment join small team 50 young professionals dynamic impactful startup setting growth opportunities expand skills advance career rapidly closeknit team take diverse responsibilities direct impact contributions shape companys success future growth making work meaningful recognized fun social activities engage regular teambuilding activities events fostering strong relationships colleagues transparency communication experience culture transparency open communication opportunities provide feedback entrepreneurial spirit develop entrepreneurial mindset gain firsthand experience building company company culture join team celebrates achievements supports one another creates environment success vacation holidays enjoy generous vacation policy holiday allowances prioritizing worklife balance wellbeing competitive compensation offer highly competitive salary attract top talent industry hard work contributions rewarded accordingly company avatar pyjamahr technologies pyjamahr technologies location india bengaluru karnataka bangalore urban job type full time visa sponsorship available remote work policy office relocation allowed experience 3 years skills python machine learning data analysis django flask nltk numpy scipy pandas scikitlearn deep learning python django numpyscipypandasscikitlearn pythondjangoflask numpyscipypandasmatplotlibscikitlearn machine learning data science python tensorflow nlp deep learning tensorflow pytorch spacy natural language toolkit nltk spacy nlp keras tensorflow sckitlearn numpy pandas spicy", "education": [], "industry_domain": ["DeepLearning", "Mechanicalengineer", "Networking", "Marketing", "MachineLearning", "DataEngineering", "Finance", "Manufacturing"], "jd_file": "jd3", "job_title": ["DeepLearning", "Mechanicalengineer", "Networking", "Marketing", "MachineLearning", "DataEngineering", "Finance", "Manufacturing"], "keyphrases": ["lead data scientist", "a115l a122l", "job aidetic scaling ai data engineering aidetic build end end ai solutions", "various industries", "sports finance ecommerce media", "aidetic", "business", "predictive analytics", "highly motivated data scientist", "expected experience", "actionable insights", "complex data sets", "datadriven decisionmaking", "machine learning", "deep learning", "apply expertise", "python tensorflow pytorch scikitlearn build deploy machine learning deep learning models", "performance accuracy", "natural language processing", "nlp techniques", "limited spacy", "valuable information", "unstructured text data", "sentiment analysis", "topic modeling", "nlp applications data preprocessing feature engineering lead data preprocessing activities", "data cleaning feature selection engineering", "data quality model effectiveness model evaluation optimization", "model performance", "solutions", "exploit opportunities", "business processes", "costs", "process automation", "resource allocation optimization", "crossfunctional teams", "engineers", "product managers", "business analysts", "seamless integration", "growth", "solutions", "cutting edge technology requirements", "deep understanding", "various applications", "expertise", "meaningful insights", "exceptional problemsolving skills", "track record", "translating datadriven insights", "actionable recommendations", "strong leadership mentoring skills", "junior data scientists", "adaptability", "keen desire", "continuous learning", "innovative environment", "excellent communication collaboration skills", "small team", "dynamic impactful startup setting", "growth opportunities", "skills", "career", "closeknit team", "diverse responsibilities", "direct impact contributions", "companys success", "future growth", "work", "strong relationships", "feedback", "entrepreneurial mindset", "firsthand experience", "company", "achievements", "environment", "generous vacation policy", "holiday allowances", "worklife balance", "wellbeing", "top talent", "company avatar", "pyjamahr technologies", "pyjamahr technologies", "location", "india", "bengaluru", "karnataka", "bangalore", "urban job type", "full time", "visa sponsorship", "remote work policy office relocation allowed experience 3 years skills", "python machine learning data analysis django flask nltk numpy scipy pandas scikitlearn deep learning python django numpyscipypandasscikitlearn pythondjangoflask numpyscipypandasmatplotlibscikitlearn machine learning data science python tensorflow nlp deep learning tensorflow pytorch spacy natural language toolkit nltk spacy nlp keras tensorflow sckitlearn numpy pandas spicy"], "language_known": [], "location": ["bengaluru", "india", "karnataka", "bangalore"], "raw_text": "Lead Data Scientist\n\u00e2\u201a\u00b915L \u00e2\u20ac\u201c \u00e2\u201a\u00b922L\nAbout the job\nAidetic\nScaling AI and Data Engineering Aidetic\nWe build End to End AI Solutions for various industries such as Sports, Finance, Ecommerce, Media etc. Aidetic helps business build capabilities for predictive analytics, scalable data engineering and production level DLML models.\n\nJob Description\nWe are looking for a highly motivated data scientist with a strong algorithmic mindset and problemsolving propensity. Since we are operating in a highly competitive market, every opportunity to increase efficiency and cut costs is critical and the candidate should have an eye for such opportunities. We are constantly innovating working on novel hardware and software so a high level of flexibility and celerity in learning is expected.\nExperience: 3-6 years of experience\n\nResponsibilities:\n\nAlgorithm Development: Develop and implement advanced algorithms to extract actionable insights from complex data sets, contributing to data-driven decision-making.\nMachine Learning and Deep Learning: Apply expertise in Python, TensorFlow, PyTorch, and Scikit-learn to build and deploy machine learning and deep learning models, optimizing performance and accuracy.\nNatural Language Processing (NLP): Utilize NLP techniques, including but not limited to SpaCy, NLTK, and Transformers, to extract valuable information from unstructured text data, enabling sentiment analysis, topic modeling, and other NLP applications.\nData Preprocessing and Feature Engineering: Lead data preprocessing activities, including data cleaning, feature selection, and engineering, to ensure data quality and model effectiveness.\nModel Evaluation and Optimization: Continuously assess model performance and implement strategies for model optimization and fine-tuning, ensuring our solutions remain state-of-the-art.\nEfficiency Enhancement: Identify and exploit opportunities to improve business processes and reduce costs by leveraging data-driven insights, such as process automation or resource allocation optimization.\nCross-functional Collaboration: Collaborate with cross-functional teams, including engineers, product managers, and business analysts, to ensure the seamless integration of data science solutions into our products and operations.\nMentorship and Leadership: Provide guidance and mentorship to junior data scientists, fostering their growth and knowledge in the field.\nStay Updated: Stay abreast of the latest developments in data science, machine learning, and AI to ensure that our solutions remain at the cutting edge of technology.\nRequirements\n\nStrong proficiency in Python and a deep understanding of data science libraries and frameworks, including TensorFlow, PyTorch, Scikit-learn, Scipy, SpaCy, NLTK, and Transformers.\nExperience in developing and deploying deep learning models for various applications.\nExpertise in NLP techniques and the ability to extract meaningful insights from textual data.\nExceptional problem-solving skills and a track record of translating data-driven insights into actionable recommendations.\nStrong leadership and mentoring skills to guide and support junior data scientists.\nAdaptability and a keen desire for continuous learning in a fast-paced, innovative environment.\nExcellent communication and collaboration skills to work effectively with cross-functional teams.\nBenefits:\n\nStartup Environment: Join our small team of 50 young professionals in a dynamic and impactful startup setting.\nGrowth Opportunities: Expand your skills and advance your career rapidly in our closeknit team, where you can take on diverse responsibilities.\nDirect Impact: Your contributions shape the companys success and future growth, making your work meaningful and recognized.\nFun and Social Activities: Engage in regular teambuilding activities and events, fostering strong relationships with colleagues.\nTransparency and Communication: Experience a culture of transparency, open communication, and opportunities to provide feedback.\nEntrepreneurial Spirit: Develop an entrepreneurial mindset and gain firsthand experience in building a company.\nCompany Culture: Join a team that celebrates achievements, supports one another, and creates an environment for success.\nVacation and Holidays: Enjoy a generous vacation policy and holiday allowances, prioritizing your worklife balance and wellbeing.\nCompetitive Compensation: We offer a highly competitive salary to attract top talent in the industry. Your hard work and contributions will be rewarded accordingly.\nCompany\nAvatar for PyjamaHR Technologies\nPyjamaHR Technologies\nLocation\nIndia \u00e2\u20ac\u00a2 Bengaluru \u00e2\u20ac\u00a2 Karnataka \u00e2\u20ac\u00a2 Bangalore Urban\nJob type\nFull Time\nVisa sponsorship\nNot Available\nRemote work policy\nIn office\nRelocation\nAllowed\nExperience\n3+ years\nSkills\nPython\nMachine Learning\nData Analysis\nDjango\nFlask\nNLTK\nNumpy\nScipy\nPandas\nscikit-learn\nDeep Learning\nPython /Django\nNumpy/Scipy/Pandas/Scikit-learn\nPython/Django/Flask\nNumpy/Scipy/Pandas/Matplotlib/Scikit-learn\nMachine Learning Data Science Python\nTensorFlow\nNLP\nDeep Learning with TensorFlow\nPyTorch\nSpaCy\nNatural Language Toolkit (NLTK)\nspaCy, NLP, Keras, Tensorflow, Sckit-Learn,numpy,pandas\nSpicy", "technical_skills": ["algorithms", "ecommerce", "sentiment analysis", "tensorflow", "optimization finetuning", "business", "data preprocessing", "collaboration", "python", "communication", "software", "data analysis", "engineering", "finance", "data science", "numpy", "automation", "analytics", "strategies", "flask", "natural language processing", "data scientist", "optimization", "libraries", "nlp", "support", "data engineering", "deep learning apply expertise python tensorflow", "deep learning models optimizing performance", "django", "keras", "deep learning python", "natural language toolkit"]}